title,newspaper,url,date,imgs,body,author,tags
New Airbnb rules would affect three-quarters of Malta’s licenced holiday homes,timesofmalta,https://timesofmalta.com/article/new-airbnb-rules-affect-threequarters-malta-licenced-holiday-homes.1101286,25-11-2024,"003314.png,003315.png,003316.png","As many as three out of every four licenced holiday homes in Malta and Gozo could be impacted by new regulations for short-term lets, according to an exercise carried out by Times of Malta.
 The plans, floated by MTA CEO Carlo Micallef last week, would see landlords who rent out short-let apartments required to get the go-ahead from their condominium neighbours before being granted a licence.
  Landlords currently need a licence from MTA to rent out their property as a holiday home.
 According to MTA data, there were just over 6,000 licenced short-let holiday homes across the Maltese islands as of this summer, 4,625 in Malta and 1,379 in Gozo.
 Nevertheless, the true number of properties on the rental market is likely to be higher. A 2019 Central Bank study found that there were a little under 9,000 properties in Malta listed on Airbnb, going for an average of €80 per night.
 More recently a study commissioned by Malta’s hoteliers found that there were just over 10,000 properties listed on Airbnb and fellow short-let platform VRBO, suggesting that almost half of all holiday homes in Malta operate without a licence.
 An analysis of MTA’s licenced properties suggests that as many as three-quarters of them form part of an apartment block or condominium.
 The remaining quarter are mostly made up of farmhouses, villas and townhouses.
 Holiday homes in Malta, where more than four of every five short-lets are believed to be situated in an apartment block, would be particularly hard-hit.
 Those in Gozo, on the other hand, are less likely to bear the brunt of the plans, with fewer than half the holiday homes on the island believed to be apartments.
  The data shows that of Malta’s 6,004 licenced holiday homes, over three-quarters (4,625) are in Malta.
 Almost half, 1,920, can be found in just three of Malta’s tourist hotspots, namely Sliema, St Julian’s and St Paul’s Bay.
 Valletta is home to over 400 properties with an MTA licence, with Mellieħa, Swieqi and Marsascala also proving popular.
 Meanwhile, Xagħra’s 190 holiday homes tops Gozo’s list, with Għarb trailing closely behind.
 
 Only three towns across Malta and Gozo – Marsa, Mtarfa and Santa Luċija – remain untouched by the Airbnb phenomenon, without a single licenced holiday home.  
 In total, Malta’s licenced holiday homes provide almost 25,000 bed spaces. 
 Tourists staying in holiday homes are frequently blamed for a myriad of problems in tourist hotspots, from littering and excessive noise, to all manners of  unruly behaviour.
 Details on how Malta plans to manage the ever-increasing Airbnb rental market remain scarce.
 Robert Abela has seemingly ruled out a Barcelona-style blanket ban,  telling  Times of Malta that the government will protect the investment of anyone who bought a property to rent it out as a holiday home.
 Meanwhile, reactions to the proposal floated by Micallef were mixed, with estate agents describing them as misguided, while others say the proposal doesn’t go far enough.

                ",Neville Borg,"National,Tourism,Hotels/Hostels/Airbnb"
Watch: ‘This is crazy. We cannot continue building more hotels’ - MHRA president,timesofmalta,https://timesofmalta.com/article/watch-this-crazy-we-cannot-continue-building-hotels-mhra-president.1096233,08-02-2024,003492.png,"Malta can no longer cope with ""excessive development of hotels"", the head of the Malta Hotels and Restaurants Association warned a tourism conference on Friday, describing the situation as ""crazy"".
 Tony Zahra was reacting to a comment that hotels needed more workers to cope with growing demand.
 “The whole of Malta is going up in flames because our power distribution system is not working,” Zahra said, referring to hours-long power cuts across Malta and Gozo in recent weeks.
 “We cannot go on building more hotels and more rooms. It’s crazy,” he said, as the audience remained silent during his intervention.
  Over the weekend, the MHRA already urged the government to stop encouraging the development of new hotel rooms and review rented accommodation and catering licensing protocols.
 The association warned that the rapid growth has led to overcrowded destinations and anti-social behaviour.
 If Malta continued building more hotels, the island would need more tourists and more arrivals. 
 “How will we handle it? Are we going to have more sewage in the sea? Are we going to have more foreign [workers]? Are we going to have to build another hospital?” Zahra reiterated on Friday.
 He said the government was “crazy” to expand the economy the way it did, however, businesses must now focus on improving the situation.
 “If we do not do that, there won’t be any industry left,” he said. 
 “How many times are we going to have people coming to Malta and say, ‘we cannot go swimming’,” he asked.
 Over the past weeks, tourists expressed their frustration over the two-month closure of the popular Balluta Bay, due to E-coli contamination.
 Zahra said the MHRA’s 2022 carrying capacity study, which claimed that Malta would need 4.7 million tourists to sustain its current occupancy availability, had been ignored. 
 “You know what people did with [the study]? They put it in the bin. If you read that report, you would see that we have reached overcapacity.”
 Addressing the conference earlier, Zahra said one of his main concerns was the country’s shift in the tourists it was attracting. 
 He said instead of seeing more families and elderly tourists coming to Malta, the airport arrivals were full of younger visitors.
 “This is a good thing, and we don’t mind it of course, but we must focus on the tourist profiles that will contribute the most to the economy,” he said. 
 ""We have the numbers and we cannot take more. If we take more tourists, we will have more problems than we already have.""
 Zahra also reacted to the decision by the popular ride-hailing platform Bolt decision to increase the fares as a result of the government's clampdown on work permits for third-country nationals. 
 “Mr Bolt, by going against our government (...) you are turning people into slaves,” he said. 
 “Bolt, please remember that you are a guest in Malta, and this is not our traditional way of doing business.”
 The Employment Minister Byron Camilleri has also warned Bolt to stop inflating prices in an attempt to import more workers. 
 According to data published at the conference, the second quarter saw an increase in tourist arrivals and their expenditure, when compared to the same months last year.
 Close to one million tourists arrived in Malta during these months, an increase of 152,000.
 They spent around €850 million, a 17 percent increase from the comparable period of 2023.
 When it comes to occupancy levels, four and five-star hotels saw a slight decrease over 2023.
",Giulia Magri,"National,Tourism,Hotels/Hostels/Airbnb,Employment"
Tourists left ‘without door lock’ at Sliema hotel room,timesofmalta,https://timesofmalta.com/article/tourists-left-without-door-lock-sliema-hotel-room.1096981,22-08-2024,003539.png,"Two tourists were forced to find alternative accommodation after discovering a hole in the door to their Sliema hotel room where a lock should have been.
 Tourist Alan Brooks said the Windsor Hotel refused to refund the May booking and that its management repeatedly failed to show up to meetings about the issue.
 He said he reported the hotel to the Malta Tourism Authority (MTA) only to be told the authority was investigating but provided no further details.
 Calling the hotel a “total scam”, Brooks said he was shocked at the way the authority handled the case, saying “they couldn’t care in the slightest... They’ve failed in every way”.
 Meanwhile, the hotel manager said the floor Brooks and his partner stayed on was closed for refurbishment – including the fitting of new locks – and should not have been sold by the booking agent.
 He said the lock issue had been resolved “way back in May”, the month of the booking, and that he was “shocked” to hear of the incident.
 The manager added that he would have booked Brooks and his partner into an alternative hotel had he known in advance or been present when they arrived.
 A spokesperson for the tourism ministry said the MTA had “thoroughly investigated” the complaint but could not provide further details for legal reasons.
 The spokesperson said the ministry and the MTA believed the complaint had been “misrepresented”, but stressed they took such incidents seriously.
 Brooks and his partner travelled to Malta in May to visit his sister, who has lived in the country for around 10 years. He said he “loves Malta” and, although he had stayed with his sister in the past, he decided to book into a hotel to give her family more space.
  After reading positive reviews of the Sliema hotel, he and his partner decided to book a room for their week in Malta.
 However, after checking in, things took a turn for the worse.
 Upon getting to their room, Brooks and his partner found a gaping hole in their door where the lock should have been. And when they checked other doors on the same floor, it was the same story, he said.
 Brooks said he spoke to around 25 other people at the hotel stuck in the same situation – some, he said, did not even have a door to their room – describing the hotel lobby as being full of angry guests when he went to complain.
 “People said strangers were walking into their room in the middle of the night and some had things stolen... they wanted to leave but most couldn’t afford to book a new hotel,” he said.
 Asked about the general conditions at the hotel, he said “that was the bizarre thing; the rooms were fine”.
 Brooks and his partner left the hotel but kept returning daily after repeatedly being promised meetings with the manager to address the issue. But the manager never showed up, he said.
 Brooks showed Times of Malta a signed document appearing to show the hotel’s management company Sovereign Hotels Ltd promising to refund him for the booking – a refund Brooks said was later refused when requested by booking agent trip.com, which ended up refunding the couple instead.
 Speaking from his home in Dublin, Brooks said he was left feeling “angry and really sad” by his experience at the hotel. “We just hated that this would happen in Malta.”
 Times of Malta found numerous mentions of issues with door locks in online reviews about the Windsor Hotel posted on Google, TripAdvisor and Booking.com.
 The hotel manager said the floor the couple stayed on was closed due to refurbishment works, “but guests apparently went to the floor and used the rooms”.
 Asked about claims of people entering rooms at night and thefts of personal property, the manager reiterated the rooms “weren’t ready to accommodate guests”.
 Confirming the MTA had investigated the incident, he said the issue was resolved “way back in May” when “only a few rooms” did not have locks. He said all rooms were now fitted with “smart locks”.
 The manager added that despite parts of the hotel being closed for bookings due to the refurbishment, some third-party booking agents had allowed guests to book rooms anyway, leaving the hotel overbooked.
 Calling the idea of allocating rooms to guests without a lock “ridiculous”, he stressed the situation was not the fault of the hotel and that he would have found alternative accommodation – if necessary, at a different hotel – for those affected had he known in advance or been present when they checked in.
 He said he was “not aware” of the meetings to discuss the issue, stressing “of course I would have met the guests personally”.
 While still in Malta, Brooks complained to the MTA about his experience and asked the authority to “urgently intervene” describing the hotel as “woefully inadequate in terms of safety and security measures”.
 The authority responded that day, promising him they would investigate and informing him that, should he “wish to follow up on the case”, he should contact the MTA enforcement department.
 But, over the following couple of months, Brooks said he received no updates on his case, apart from repeatedly being told the authority was investigating.
 Two months after his original complaint, he finally received a response from the MTA saying it “together with its legal advisers has determined the best way forward and taken action as deemed necessary” but was provided with no further information.
 Commenting on the MTA’s response to his case, Brooks said the authority had “failed in every way; the regulator has a moral and legal responsibility to tourists in Malta – the buck stops with them”.
 But a tourism ministry spokesperson said the hotel management was “already implementing measures to address the concerns raised” when the MTA inspected the premises “immediately” after receiving Brooks’ complaint.
 He said the authority was “continuously monitoring the situation and will take further action if necessary”.
 Noting there were “discrepancies” between Brooks’ and the hotel’s version of events, the spokesperson said Brooks had been advised to seek a refund privately, noting the MTA “does not have jurisdiction in such matters”.
",James Cummings,"National,Tourism,Sliema"
Gozo Tourism Association stress sustainability in 2025 budget proposals,timesofmalta,https://timesofmalta.com/article/gozo-tourism-association-stress-sustainability-2025-budget-proposals.1097318,28-08-2024,004653.png,"Policy in Gozo should be focused on keeping tourism levels on the sister island sustainable, the Gozo Tourism Association said in its 2025 budget proposals. 
 This comes after association members said they are seeing a drop in revenue despite an increase in tourists visiting Gozo. 
 “Gozo as a tourist destination has to be prepared to offer the advertised and marketed touristic product. The upkeep, cleanliness and organisation of Gozo as well as that of the touristic establishments are to reflect and match the expectations of the visitors to the Island. Furthermore, Gozo has to remain competitive in the product and services on offer, whilst ensuring that the visitors get the value for money spent,” they said. 
 To improve connectivity between Malta and Gozo, the group proposed a fourth ferry to replace the Nikolaus and the introduction of a smart ticketing system which will allow people to commute on different transport modes with a common ticket. 
 Discussing the environment, the association said it does not want Gozo to become a small Malta and therefore Malta’s planning policies are not necessarily appropriate to keep in Gozo. 
 To this end, they called for a new regional plan and planning policies specifically designed for Gozo to be preserved as an “island of villages”. 
 Incentives to purchase UCA property should be retained, they said, while those which benefit vernacular and post-war properties where buyers pledge to maintain the integrity of the property should be extended. 
 They also proposed a new fiscal incentive encouraging the restoration of traditional properties and converting them into boutique hotels. 
 A marine reserve should also be established around the Gozitan coast and this should be enforced similarly to the Ċirkewwa marine reserve. 
 In order to promote Gozo as a distinct destination, the GTA also made a series of proposals suggesting upgrades to the island’s tourism product. 
 ECO contribution collected from Gozitan accommodations should be reinvested in strategic upgrading, like kiting areas for the diving community. 
 VAT that is applied to tickets for shows, theatres, fairs amusement parks, concerts, museums and other similar events and facilities should be reduced from 18% to 7%, they said. 
 A new underground multi-level car park to alleviate the lack of parking spaces in Victoria is also needed, they said. 
 A tailor-made tourism investment support scheme should also be implemented to entice local entrepreneurs to upgrade their Gozitan establishments. 
 They also urged the authorities to amend the summer construction break and prohibit all excavation and demolition works from taking place within a 50-meter radius of any MTA-licensed premises. 
 The association also made other proposals aimed at improving marketing Gozo overseas and improving human resources challenges. 
 “Tourism on the Island region of Gozo is also facing several challenges. While all National and Regional policies and strategies are pointing and directing towards a distinct destination, focusing on particular niche markets based on the island’s unique selling propositions, the tourism sector is very much concerned that the overdevelopment of Gozo is jeopardising and lambasting the core of these tourism values, the GTA said in its conclusion. 
 “These overdevelopments, mostly for residential purposes are impacting negatively the character of our little island, a proposition on which the tourism sector has been for years marketing and promoting Gozo with, as well as creating trends which are not naturally touristic.”
 ",Times of Malta,"National,Gozo,Tourism"
Malta Airport sees new passenger record in May,timesofmalta,https://timesofmalta.com/article/malta-airport-sees-new-passenger-record-may.1093825,06-11-2024,"004576.png,004577.png","Airport passenger movements in May broke the 2023 record by more than 18 per cent, MIA said on Tuesday.
 It also reported substantial growth in aircraft movements and seat capacity and a strong seat load factor of 85.9 per cent.
 Malta International Airport said it handled 858,402 passengers last month, up by 18.2 per cent, or more than 132,000.
 That accompanied a 13.8 per cent increase in aircraft movements, with a total of 5,607 take-offs and landings recorded in May, and a rise of 14.1 per cent in seat capacity.
 A high seat load factor of 85.9 per cent also demonstrated strong demand for air travel and efficient utilisation of available seats, MIA said.
 Italy, the United Kingdom, and Germany continued to dominate Malta International Airport’s market leaderboard, collectively holding just over 50 per cent of the market share.
 France and Poland secured the fourth and fifth positions respectively, with Poland achieving the most substantial growth, increasing by 62.4 per cent over 2023. 
 ",Times of Malta,"National,Tourism"
Watch: Tourist credits receptionist for saving her life during Sliema stay,timesofmalta,https://timesofmalta.com/article/watchbritish-tourist-thanks-receptionist-saving-life-sliema-stay.1101122,17-11-2024,"005141.png,005142.png,005143.png","A tourist has credited the quick thinking of a night receptionist at a Sliema hotel with saving her life, enabling her to celebrate her 90th birthday this year.
 Ruth Burton, a British national, expressed heartfelt gratitude to John Cuschieri, 66, the night receptionist at the Preluna Hotel, for his swift actions when she suffered a heart attack in November last year.
 “It’s all thanks to John’s quick thinking that I am here again this November,” Burton said.
  Burton, who turned 90 in May, has been a loyal visitor to the Preluna since 2001. Every November, she travels to Malta to escape Lincolnshire’s cold winters and attend the Remembrance Sunday services. These trips are part of an annual tradition that holds sentimental value, rooted in the memory of her late husband, Alexander Burton, a Navy serviceman.
 However, last year’s visit took an unexpected turn.
 On the evening of November 14, following a game of Uno with her daughter Anne and son-in-law Peter, Burton began feeling unwell.
  “I went to bed and began to feel ill, and then I started to feel even worse,” she recounted.
 At around 2 am, feeling hot, sweaty, and experiencing pain in her shoulders, Burton called reception to request medical assistance.
 “Her voice was very emotional, and I could feel something was wrong,” Cuschieri said.
 Recognising the urgency, Cuschieri promptly arranged for another staff member to cover the front desk and rushed to her room. There, he found Burton shaking in bed and acted quickly to manage the situation.
 “I rushed back down and called the ambulance,” Cuschieri recalls. He also informed Burton’s family, who were staying at the same hotel, ensuring they could accompany her to the hospital.
 An ambulance arrived within minutes. Tests confirmed Burton was having a heart attack, but timely intervention saved her and eventually allowed her to recover.
 Cuschieri, who has worked at the Preluna Hotel for 46 years, says he was just doing his job. 
 “I am positive my colleagues would have done the same thing. I am not special,” he said, crediting only his ability to remain calm in emergencies.
 “This happens quite often – at least once every two months,” he said.
 But Burton remains deeply grateful for the receptionist’s quick thinking, which allowed her to continue her long-standing tradition of visiting Malta for Remembrance Sunday.
 The Preluna Hotel is a popular choice for older tourists during the winter months. Many, like Burton, consider it a second home. Burton and her late husband began visiting Malta each November to attend Remembrance Day services, forging a deep connection with the island.
 Although Alexander did not serve in Malta during his Navy career, he had stopped there during World War II. Over time, the couple developed a strong affection for the island, making it their sole holiday destination.
  “I don’t do any other holidays, just Malta. It feels like you come to live here for three to four weeks,” Burton said.
 Dressed in a vibrant red shirt, a poppy-print skirt and a Maltese cross necklace, Burton proudly displayed her husband’s medals. Since her husband’s passing in 2018, she has continued the tradition, often attending the commemorations with her daughter, son-in-law and grandson Steven who wear’s Alexander’s medals.
 
 For Cuschieri, the heart attack episode was all in a day’s work but over the last year kept thinking whatever had happened to her. 
 “It was like winning the lottery”, said Cuschieri when he saw Burton walking through the doors of the Sliema hotel.
 For Burton, his actions meant the world, and she repeatedly thanked him. A lifetime of memories on the island now includes the moment it gave her another chance at life.
 “I’ll keep coming back as long as I can, and even then, they might have to carry me out!” Burton said.

                ",Emma Borg,"National,Tourism,Sliema,Features,History"
