title,newspaper,url,date,imgs,body,author,tags
"Save the Maltese goat, breeders urge the government",timesofmalta,https://timesofmalta.com/article/save-maltese-goat-breeders-urge-government.1096846,16-08-2024,"007445.png,007446.png,007447.png,007448.png","The population of indigenous goats has dropped to under 1,000, prompting rearers to urge the government to recognise the breed as critically endangered.
 In a letter to Animal Rights Minister Anton Refalo, the Breeds of Origin Conservancy and Koperattiva Maltija tal-Mogħoż u n-Nagħaġ called for official recognition of the local indigenous goat as ""a critically endangered traditional population and local breed that is at risk"".
  Darryl Grech, on behalf of the voluntary organisation and the cooperative said the local breed would classify as such in line with guidelines issued by the UN's Food and Agriculture Organization.
 
 In a statement, Grech said that despite its cultural and historical contribution to the Maltese islands, the goat unjustly remained without the recognition it deserved.
 Grech notes that the population of the breed dropped at ""an alarming rate"" over the past five decades. 
 There were now under 1,000 indigenous goats in Malta.
  ""This indigenous population should be valued and maintained for the benefit of biodiversity.
 ""Considering the growing consensus on the need to safeguard native breeds, this is an attempt to retrieve, analyse and combine information to characterise the remaining indigenous goats of the Maltese islands, identify the current status and size of the population, and develop comprehensive criteria that may serve as a basis for future breeding and selection programs.""
  ",Times of Malta,"National,Animal welfare,Food and drink,Tradition,Heritage"
New study: Development permits used as political tool in Malta,theshiftnews,https://theshiftnews.com/2023/11/18/new-study-development-permits-used-as-political-tool-in-malta/,18-11-2023,"000098.png,000099.png","The number of granted development permits has skyrocketed since 2013, contributing to a significant increase in urban sprawl, a new study published by the environmental peer-reviewed journal Sustainability shows.
 The study charts urban growth in Malta using planning application data from the past 30 years. Besides increased approved permits coinciding with economic and population growth, its findings support the notion that their permit-granting may have been used as a political vote-buying tool.
 Authored by four Maltese researchers from the University of Malta, the study used data mining techniques to analyse thousands of development planning applications between 1993 and 2019 to chart trends and urban sprawl.
 The study found a particular increase in granted development applications resulting in urban growth since the post-2013 construction boom. It also found that outside development zone permits and permits granted despite a case officer report for their refusal increased before elections.
 Discussing the latter findings, the researchers said the results “support the hypothesis that land development and the institutions regulating it are used as a political mechanism by the incumbent government to garner votes during elections.”
 The researchers found that while there was a decrease in the share of granted permits that contributed to urban sprawl, “the absolute number of granted development planning applications resulting in growth has increased, particularly in the last construction boom (post-2013).”
 It concluded that urban growth shows that “the construction industry is closely linked to the islands’ economic cycles and changes in population,” noting a particular slump in 2011.
 “The spike in development-planning application permits in the last few years corroborates the observed construction boom,” they said. They noted how economic and population growth alongside a relaxation in planning policies had been identified as contributing to the trend.
 The study also looked at the number of planning applications granted in ODZ areas, using linguistic and data analysis to determine the ones contributing to urban growth. Since the 90s, a steady share of over 10% of applications were granted on ODZ.
 In particular, 2017 and 2018 were identified as the years with the highest numbers of such permits. The findings led the researchers to suggest a study into “the effectiveness of the ODZ designation and assessing whether this zone is fulfilling its raison d’ être in conserving rural areas has become a transitional zone for development.”
 Additionally, the study recommended a “standardisation of descriptors in development-planning applications” for improved transparency. The researchers hoped for a more data-driven approach to studying current and future urban planning policy.
 The study published in  Sustainability was conducted by Andrea Pace, Maria Attard, Michel Camilleri and Gianluca Valentino.
 The researchers hail from the Department of Geography, Insitute for Climate Change and Sustainable Development, Department of Computer Information Systems and Department of Communications and Computer Engineering at the University of Malta.
",Sean Montebello,Tourism
"MIA welcomed more than 8.3 million passengers between January and November, reaching record - The Malta Independent ",independent,https://www.independent.com.mt/articles/2024-12-11/local-news/MIA-welcomed-more-than-8-3-million-passengers-between-January-and-November-reaching-record-6736266445,11-12-2024,000144.png,"
                
        

         Malta International Airport welcomed more than 8.3 million passengers between January and November this year, with the 8 millionth passenger milestone being reached for the first time in the airport's history on the 12th of November, 2024. 
 ""Marking a 15% increase over the same comparable period last year, the strong year-to-date performance has already confirmed 2024 to be the airport's best performing year to date,"" a company announcement on the Malta Stock Exchange read.  ""In November, 630,637 passengers travelled through the airport, translating into a double-digit growth of 19.2% over the same month in 2023. Traffic peaked towards the beginning of the month, with 26,936 passenger movements being registered on Saturday 2nd November, the month's busiest day. This growth in passenger numbers in November was experienced in parallel with an upturn of 19.8% in aircraft movements and an increase of 18.3% in seat capacity over the same month in 2023.""
 Seat load factor (SLF) also gained 0.7 percentage points over last year, to stand at 85.6%, it said.
 ""The top contributor to November's traffic was Italy (+9.6% over 2023) with a market share of 20%, followed by the United Kingdom (+16.7%). The most significant growth within the airport's top markets, however, was observed in the Polish market (+56%). Overtaking Germany and Spain, Poland secured the third spot on Malta International Airport's market leaderboard, with this result having been achieved last in January 2024.""
 
    ",,Tourism
Number of tourists in first 9 months increases by 21% - NSO  - The Malta Independent ,independent,https://www.independent.com.mt/articles/2024-11-12/local-news/Number-of-tourists-in-first-9-months-increases-by-21-NSO-6736265666,12-11-2024,000234.png,"
                
        

         Inbound tourists for the first three quarters of 2024 amounted to 2,766,584, an increase of 21.1 per cent over the same period in 2023, the NSO said Tuesday
 Total nights spent by inbound tourists went up by 13.7 per cent, almost reaching 17.9 million nights.
 Total tourist expenditure was estimated at €2.6 billion, 23.4 per cent higher than that recorded for the same period in 2023. Total expenditure per capita increased to €926 from €908 for the corresponding period in 2023.  The number of tourists visiting Gozo and Comino, including both same-day and overnight visitors, totalled 1,634,304, or 59.1 per cent of total tourists.
 September
 Total inbound tourists for September 2024 were estimated at 361,015, an increase of 20.7 per cent when compared to the corresponding month in 2023.
 During the month under review, a total of 339,497 inbound tourists visited Malta for holiday purposes, and 15,078 tourists came for business purposes. The largest share of inbound tourists were aged between 25 and 44 (36.4 per cent), followed by the 45-64 age bracket (28.5 per cent). British, Italian, and French residents made up 47.1 per cent of total inbound tourists.
 Total nights spent went up by 15.6 per cent when compared to September 2023, almost reaching 2.5 million nights. The largest share of guest nights (86.8 per cent) was spent in rented accommodation establishments. The average length of stay of total inbound tourists stood at 6.9 nights.
 Total tourist expenditure surpassed €385.8 million, an increase of 24.1 per cent over the corresponding month in 2023. The average expenditure per night was estimated at €154.8.
 The number of tourists visiting Gozo and Comino, including both same-day and overnight visitors, totalled 224,950, or 62.3 per cent of total tourists.
 
    ",,Tourism
Plans filed to replace Qawra White Dolphin Hotel complex with 144-room hotel - The Malta Independent ,independent,https://www.independent.com.mt/articles/2024-10-22/local-news/Plans-filed-to-replace-Qawra-White-Dolphin-Hotel-complex-with-144-room-hotel-6736265102,22-10-2024,000291.png,"
                
        

         Plans have been filed to demolish the existing White Dolphin Hotel complex in Qawra and replace it with a 10-storey, 144-room budget hotel.
 Situated on Triq Dawret il-Qawra a stone's throw away from the coast, the White Dolphin is a complex of budget self-catered apartments with a restaurant and pool area included at ground floor level.
 The plans, which have been filed by Louis Gauci who listed himself as an owner of the site, envision the total demolition of the current site and its replacement with a new hotel with three underground levels and 10 over-ground levels, the topmost being a receded floor.  This would see the site rise higher than was previously approved. In 2017, a planning application was approved that permitted the site to rise to 7 levels.
 The applicant is proposing a three-star hotel which will contain 144 rooms with a total of 288 beds.  Although not formally written down, plans filed with the Planning Authority indicate that the hotel will be part of French megabrand ibis Hotels.
 The ibis logo is in fact presented on one of the hotel's walls in elevations presented in the planning application.  Ibis is a global franchise and has over 2,000 hotels worldwide under its name.  There is already an ibis Styles hotel in St Paul's Bay, a stone's throw away from the Bugibba Square.
 The currently existing White Dolphin Hotel is something of a holiday complex more than a hotel.  It is made up of 45 self-catered apartments with a communal pool at ground level and a bar and restaurant open in peak seasons.
 The new project will include 49 parking spaces split across three newly excavated basement levels, together with amenities such as a restaurant, an indoor pool with a spa, a gym, a coffee shop, a rooftop bar and a 95 square metre outdoor infinity pool at roof level.
 The Malta Tourism Authority said in planning consultations that it has no objection to the application, and the Environment & Resources Authority, similarly, said it has no problems with the plans either.
 More planning consultations must take place with varying entities, before a Planning Authority case officer will issue a recommendation on whether the project should be granted approval or not.
 
    ",Albert Galea,Tourism
KM Malta Airlines adds extra flights to European destinations during holiday season,maltatoday,https://maltatoday.com/news/national/132050/km_malta_airlines_adds_extra_flights_to_european_destinations_during_holiday_season_,30-10-2024,000328.png,"KM Malta Airlines have announced they secured the necessary airport slot times to be able to operate thirty additional flight rotations into and out of Malta during the forthcoming busy Christmas and New Year holidays.

 During the period 21 December 2024 to 5 January 2025, KM Malta Airlines will operate the following additional services in addition to its normal Winter scheduled flights:

 These flights are now on sale and can be sourced through logging on to www.kmmaltairlines.com to check dates and times of these additional flights.     ",Karl Azzopardi ,Tourism
'Gentle soul' Oriana Bertolino identified as victim of Gozo quad bike crash,timesofmalta,https://timesofmalta.com/article/gentle-soul-oriana-bertolino-identified-victim-gozo-quad-bike-crash.1094689,30-06-2024,"000390.png,000391.png","31-year-old volleyball player Oriana Bertolino has been identified as the victim of Saturday's horrific quad bike plunge at Wied Mielaħ in Gozo.
 Tributes poured in on social media on Sunday, along with messages of shock, disbelief and condolences, as her family and friends learned about her death.
 They hailed her as a ""fantastic person who was always smiling"" and as a volleyball player and coach who had ""a brilliant career"" and who loved animals and coaching children.
 Others said her intelligence was unmatched, her soul gentle, and described her as ""an excellent human and professional"".
  Bertolino died when a quad bike she was riding crashed off a cliff and into the sea along one side of scenic Wied il-Mielaħ in Għarb at around 8pm on Saturday.
 The vehicle was being driven by a 47-year-old Italian man who, police said, lost control of it. He managed to jump to safety as the quad bike crashed over the cliff edge and into the sea but Bertolino, who was a passenger, fell into the sea.
 Her body was recovered after a search, but she succumbed to her injuries.
 It is understood she was in Malta on vacation.
 Many heartbreaking messages came from the Sicilian town of Marsala, where Oriana hailed from.
  Mayor Massimo Grillo announced the news on social media on Sunday, saying her death leaves an ""empty void in the hearts of all who knew her"".
 ""In these moments of pain I would like to express, on behalf of the municipal administration and all the citizens of Marsala, our most felt condolences and our closeness to Oriana's family,"" he wrote.
 ""May Oriana rest in peace and her family find the strength to deal with this enormous pain.""
 Two weeks ago, on her Facebook page, Bertolino posted a message about life choices, saying everyone should be peaceful in their own way.
 ""And that's all. Friends get married, live together and start families. I play the PlayStation, read a fantasy book a day, and save the animals. There is no such thing as ""right"" that goes for everyone. Everyone should be peaceful in their own way,"" she wrote.
  Sources close to the investigation told Times of Malta on Sunday that the police and the Italian embassy in Malta informed her family about their daughter's tragic death and they are expected to come to Malta in the coming days.
",Mark Laurence Zammit,Tourism
